{
  "candidate_id": "OWNER_CANDIDATE_EXAMPLE_001",
  "title": "Short human-readable candidate name",
  "source_type": "owner_supplied_material",
  "provenance": "Where this candidate came from and why it is trusted enough to inspect",
  "intended_capability": "What capability this candidate should help Builder grow",
  "risk_notes": "Known risks, uncertainty, external dependencies, license/terms concerns",
  "acceptance_expectation": "What must be true before this can become an accepted atom",
  "proposed_files": [],
  "owner_notes": "Optional notes"
}
